country_code,song_title,song_title_en,song_title_translation_en,song_title_translation_ru,langs_en,langs_en_minor,langs_ru,langs_ru_minor,lyrics_original,lyrics_en,lyrics_ru,lyrics_size_modifier,genre_en,genre_ru,facts_en,facts_ru,national_final_url,music_video_url,round_sf,order_sf,number_sf,qualified_to_final
HR,Andromeda,,,Андромеда,Croatian,,Хорватский,,"[Strofa 1: Korina Olivia Rogić, Lelek]
Dok pališ svijeću, pitaj svoju baku
Zašto je kćeri rađala u strahu
Zašto su mnogi odabrali groblje
Nisu naše majke iznjedrile roblje

[Strofa 2: Judita Storga, Lelek]
Mnoge su suze potekle kô rijeka
Zašto se piše povijest ispočetka?
Sinovi naši nisu podanici
Da l' vas noću bude iz kolijevke krici?

[Predrefren: Lelek]
Uzmi me sebi, kraljice Zemljo
Tvoja je duša, njima sam tijelo

[Refren: Lelek]
Vodi me do zvijezda, porušenih gnijezda
Tamo gdje uz krike isprate vojnike
Vodi me do zvijezda, daleko od pogleda
Andromeda

[Strofa 3: Marina Ramljak, Lelek]
Sve urezane ožiljke do kosti
Ni jedna majka neće vam oprostit'
Na stolu srama zlato sa đerdanâ
Dok peru ruke krvlju naših rana

[Most: Judita Storga, Marina Ramljak, Lara Brtan, Lelek]
Izdajice
Izdajice
Izdajice
Izdajice

[Predrefren: Lelek]
Uzmi me sebi, kraljice Zemljo
Tvoja je duša, njima sam tijelo

[Refren: Lelek]
Vodi me do zvijezda, porušenih gnijezda
Tamo gdje uz krike isprate vojnike
Vodi me do zvijezda daleko od pogleda
Andromeda
Vodi me do zvijezda, porušenih gnijezda
Tamo gdje uz klike isprate vojnike
Vodi me do zvijezda daleko od pogleda
Andromeda

[Završetak: Lelek]
Andromeda
Andromeda (Andromeda)
Andromeda
Andromeda (Andromeda)
Andromeda
Andromeda","[Verse 1]
As you light a candle, ask your grandmother
Why she gave birth to her daughters in fear
Why so many chose the grave
Our mothers did not give birth to slaves

[Verse 2]
So many tears have flowed like a river
Why is history written from scratch?
Our sons are not subjects
Are screams from the cradle waking you up at night?

[Pre-Chorus]
Take me for yourself, Queen Earth
The soul is yours, to them I'm a body

[Chorus]
Lead me to the stars, to the shattered nests
There where, amid screams they send off soldiers
Lead me to the stars, far from all eyes
Andromeda

[Verse 3]
All the scars carved down to the bone
No mother will forgive you
On the table of shame, the gold from necklaces
While they wash their hands in the blood of our wounds

[Bridge]
Traitors
Traitors
Traitors
Traitors

[Pre-Chorus]
Take me for yourself, Queen Earth
The soul is yours, to them I'm a body

[Chorus]
Lead me to the stars, to the shattered nests
There where, amid screams they send off soldiers
Lead me to the stars far from all eyes
Andromeda
Lead me to the stars, to the shattered nests
There where, amid screams they send off soldiers
Lead me to the stars far from all eyes
Andromeda

[Outro]
Andromeda
Andromeda (Andromeda)
Andromeda
Andromeda (Andromeda)
Andromeda
Andromeda","[Куплет 1]
Как зажжёшь свечу, спроси свою бабушку
Почему дочерей родила она в страхе?
Почему так многие выбрали смерть?
Наши матери рожали не рабов

[Куплет 2]
Много слез лилось рекой
Почему история пишется с нуля?
Наши сыновья — не чьи-то подданые
Вас ночью будят из колыбели крики?

[Предприпев]
Возьми меня с собой, королева Земля
Твоя моя душа, а для них лишь тело.

[Припев]
Веди меня к звёздам, разрушенным гнёздам
Туда, где криками провожают солдат
Веди меня к звёздам, с глаз долой
Андромеда

[Куплет 3]
Все шрамы пронзили кожу до костей
Ни одна мать вас не простит
На столе позора — золото ожерелий
Пока они умывают руки кровью с наших ран

[Бридж]
Предатели
Предатели
Предатели
Предатели

[Предприпев]
Возьми меня с собой, королева Земля
Твоя моя душа, а для них лишь тело.

[Припев]
Веди меня к звёздам, разрушенным гнёздам
Туда, где криками провожают солдат
Веди меня к звёздам, с глаз долой
Андромеда
Веди меня к звёздам, разрушенным гнёздам
Туда, где криками провожают солдат
Веди меня к звёздам, с глаз долой
Андромеда

[Аутро]
Андромеда
Андромеда (Андромеда)
Андромеда
Андромеда (Андромеда)
Андромеда
Андромеда",,Folk-pop,Фолк-поп,"In Turkey, the song and music video caused a scandal: the lyrics and visuals were seen as criticism of the Ottoman Empire and as a depiction of Croatian women being enslaved by Turks.
",В Турции песня и клип вызвали скандал: слова и визуал восприняли как критику Османской империи и изображение порабощения хорваток турками.,https://www.youtube.com/watch?v=OMCR-8gmgso,https://www.youtube.com/watch?v=vl7Jqnw10sU,SF1,3,3,
IL,Michelle,,,Мишель,"French, Hebrew, English",,"Французский, Иврит, Английский",,"[Intro]
Mm-mm
Mm-mm
Mm-mm, mmm

[Verse 1]
מישל זו אהבה רעילה, אני באפלה
?איך השארת אותי בצל
כוכבת בלי תהילה
משוגעת גדולה
אני קם ונופל

Oh, Michelle
Je ne sais plus quoi faire
Tu étais ma lumière
Dieu j't'en supplie réveille-moi
J'ai plongé dans le noir
Ramène-moi de l'espoir
Et ma mademoiselle

[Pre-Chorus]
Alors je danse, danse avec les maux
Tu me verras rire, rire à nouveau
T'es ma douleur, j'n'étais qu'un décor
J'ai crié, crié, crié

[Chorus]
Michelle
Je te laisse partir, adieu ma belle
Je te laisse partir, mais je t'aime
La reine des problèmes
Michelle, Michelle, Michelle, Michelle

[Post-Chorus]
Aye-aye-aye-aye-aye-aye (Oh-oh, oh-oh)
Aye-aye-aye-aye-aye-aye (Oh-oh, oh-oh)

[Verse 2]
Walking down Florentin
Ocean eyes, memories
I (I), I'm losing my mind

[Pre-Chorus]
An angel, but is it hell?
Trapped in your carousel
'Round and 'round ('Round and 'round)
Under your spell

[Chorus]
Michelle (Michelle)
Je te laisse partir, adieu ma belle
Je te laisse partir, mais je t'aime
La reine des problèmes
Michelle, Michelle, Michelle, Michelle

[Post-Chorus]
Aye-aye-aye-aye-aye-aye (Oh-oh, oh-oh)
Aye-aye-aye-aye-aye-aye (Oh-oh, oh-oh)
Ooh (Oh-oh, oh-oh)
Ooh (Oh-oh, oh-oh)

[Bridge]
ואולי בסוף יהיה לנו טוב
מתפלל עלייך שתזכי לאהוב
בין דמעה לדמעה יש מי שישמע
יש מי שישמע

[Chorus]
(Michelle)
Je te laisse partir, adieu ma belle (Michelle)
Je te laisse partir, mais je t'aime
La reine des problèmes
Ooh (Oh-oh, oh-oh)

[Outro]
Oh, je t'aime
Ma reine des problèmes
Michelle, Michelle, Michelle, Michelle","[Intro]
Mm-mm
Mm-mm
Mm-mm, mm-mm

[Verse 1]
Michelle, this is a toxic love, I'm in the darkness
How did you leave me in the shadows?
A star without fame,
A great madwoman
I rise and fall

Oh, Michelle
I no longer know what to do
You were my light
God, I beg you, wake me up
I plunged into the dark
Bring me back some hope
And my mademoiselle

[Pre-Chorus]
So I dance, dance with the pain
You will see me laugh, laugh again
You're my pain, I was only a decoration
I screamed, screamed, screamed

[Chorus]
Michelle
I'm letting you go, goodbye my beautiful
I'm letting you go, but I love you
The queen of problems
Michelle, Michelle, Michelle, Michelle

[Post-Chorus]
Aye-aye-aye-aye-aye-aye (Oh-oh, oh-oh)
Aye-aye-aye-aye-aye-aye (Oh-oh, oh-oh)

[Verse 2]
Walking down Florentin
Ocean eyes, memories
I (I), I'm losing my mind

[Pre-Chorus]
An angel, but is it hell
Trapped in your carousel
'Round and 'round ('Round and 'round)
Under your spell

[Chorus]
Michelle (Michelle)
I'm letting you go, goodbye my beautiful
I'm letting you go, but I love you
The queen of problems
Michelle, Michelle, Michelle, Michelle

[Post-Chorus]
Aye-aye-aye-aye-aye-aye (Oh-oh, oh-oh)
Aye-aye-aye-aye-aye-aye (Oh-oh, oh-oh)
Ooh (Oh-oh, oh-oh)
Ooh (Oh-oh, oh-oh)

[Bridge]
And maybe in the end, things will turn out well for us
Pray on you that you will get to love
Between tear to tear, there is someone who will hear
There is someone who will hear

[Chorus]
(Michelle)
I'm letting you go, goodbye my beautiful (Michelle)
I'm letting you go, but I love you
The queen of problems
(Ooh; Oh-oh, oh-oh)

[Outro]
Ooh, I love you
My queen of problems
Michelle, Michelle, Michelle, Michelle","Мм-мм
Мм-мм
Мм-мм, мм-мм

Мишель, от этой токсичной любви я брожу во тьме,
Зачем ты оставила меня в тени?
Звезда, не получившая славы,
Настоящая сумасшедшая,
Я поднимаюсь и снова падаю.

О, Мишель,
Я больше не знаю, как мне быть,
Ты была моим светом,
Боже, молю, дай мне проснуться,
Я утонул во тьме,
Верни мне надежду
И мою возлюбленную.

И я кружусь в танце с болью,
Ты увидишь, как я вновь смеюсь,
Ты моя боль, а я лишь декорация,
И я кричу, кричу, кричу.

Мишель,
Я отпускаю тебя, прощай, моя любимая,
Я отпускаю тебя, хоть и люблю,
Королева всех моих проблем —
Мишель, Мишель, Мишель, Мишель.

Аи-аи-аи-аи-аи-аи (о-о, о-о)
Аи-аи-аи-аи-аи-аи (о-о, о-о)

Проходя по району Флорентин,
В воспоминаниях твои глаза, как океан,
Я (я) схожу с ума,

Она ангел, а это ли не ад?
Я застрял в твоей карусели,
Всё по кругу (по кругу),
Я под твоими чарами.

Мишель (Мишель),
Я отпускаю тебя, прощай, моя любимая,
Я отпускаю тебя, хоть и люблю,
Королева всех моих проблем —
Мишель, Мишель, Мишель, Мишель.

[Post-Chorus]
Аи-аи-аи-аи-аи-аи (о-о, о-о)
Аи-аи-аи-аи-аи-аи (о-о, о-о)
Оо (о-о, о-о)
Оо (о-о, о-о)

А, может, всё в итоге хорошо для нас сложится,
Я молюсь, чтобы тебе выпала возможность полюбить,
После пролитых слёз найдётся кто-то,
Кто услышит тебя.

(Мишель)
Я отпускаю тебя, прощай, моя любимая (Мишель),
Я отпускаю тебя, хоть и люблю,
Королева всех моих проблем
(Оо; о-о, о-о)...

О, я люблю тебя,
Королева всех моих проблем –
Мишель, Мишель, Мишель, Мишель.",,"Pop, Chanson, Ballad","Поп, Шансон, Баллада",,,,https://www.youtube.com/watch?v=xWCnWSoG8nI,SF1,11,10,
IT,Per sempre sì,,Forever Yes,Да — навсегда,Italian,Neapolitan,Итальянский,Неаполитанский,"[Strofa 1]
È cominciato tutto quanto dal principio
Io che per te ero solo un uomo sconosciuto
Poi diventato un re dal cuore innamorato
Tu una regina, ora vestita in bianco sposa
Abbiamo sognato figli in una grande casa
E superato tutte le difficoltà
Perché un amore non è amore per la vita
Se non ha affrontato la più ripida salita

[Pre-Ritornello]
E si accenderà la musica e qui ti aspetterò
Il più grande giorno ti regalerò

[Ritornello 1]
Saremo io e te per sempre
Legati per la vita che
Senza te non vale niente
Non ha senso viverе
Con la mano sul petto
Io te lo prometto davanti a Dio
Sarеmo io e te da qui
Sarà per sempre ""sì""

[Strofa 2]
So bene che è una grande incognita il futuro
Ma insieme a te non mi spaventerà perché
Costruiremo tutto, ma non alzeremo un muro
Litigare e far l'amore e poi che male c'è?

[Pre-Ritornello]
E si accenderà la musica, per te io canterò
Il più grande giorno ti regalerò

[Ritornello 1]
Saremo io e te per sempre
Legati per la vita che
Senza te non vale niente
Non ha senso vivere
Con la mano sul petto
Io te lo prometto davanti a Dio
Saremo io e te da qui
Sarà per sempre ""sì""

[Bridge]
Soltanto ""sì""
Per questi giorni e mille altri ancora
Un semplice ""sì""
L'eternità è dentro una parola

[Ritornello 2]
Saremo io e te per sempre
Legati per la vita che
Senza te non vale niente
Non ha senso vivere
Con la mano sul petto
Io te lo prometto davanti a Dio
Saremo io e te accussí
Sarrà pe sempe ""sì""","[Verse 1]
It all started right from the beginning
I, who was just an unknown man to you
Then became a king with a heart in love
You a queen, now dressed in white as a bride
We dreamed of children in a big house
And overcame all the difficulties
Because a love isn't a love for life
If it hasn't faced the steepest climb

[Pre-Chorus]
And the music will start playing and I will wait for you here
I will give you the greatest day

[Chorus]
It will be you and me forever
Tied for this life that
Without you is worth nothing
Makes no sense to live
With my hand on my chest
I promise you before God
It will be you and me
From here on, it will forever be ""Yes""

[Verse 2]
I know well that the future is a great unknown
But together with you, it won't scare me because
We will build everything, but we won't raise a wall
Fighting and making love, and then what's wrong with that?

[Pre-Chorus]
And the music will start playing, I will sing for you
I will give you the greatest day

[Chorus]
It will be you and me forever
Tied for this life that
Without you is worth nothing
Makes no sense to live
With my hand on my chest
I promise you before God
It will be you and me
From here on, it will forever be ""Yes""

[Bridge]
Only ""Yes""
For these days and a thousand more
A simple ""Yes""
Eternity is inside one word

[Chorus]
It will be you and me forever
Tied for this life that
Without you is worth nothing
Makes no sense to live
With my hand on my chest
I promise you before God
It will be you and me
And so it will forever be ""Yes""","[Куплет 1]
Всё началось когда-то с самого начала
Я для тебя был просто незнакомцем
Но стал потом влюблённым королём
А ты — моей царицей в белом свадебном наряде
Мы грезили о детях в большом доме
И через все прошли мы испытанья
Ведь любовь нельзя назвать любовью на всю жизнь
Если она не прошла огонь и воду

[Предприпев]
И заиграет музыка, и буду ждать тебя я здесь
Величайший день тебе я подарю

[Припев]
Будем только ты и я
Связанные жизнью навсегда
Которая без тебя ничего не стоит
В которой нет смысла жить
С рукой на сердце
Я клянусь тебе пред Богом
Будем только ты и я
И с этого дня — навечно «да»

[Куплет 2]
Я знаю: будущее полно неизвестности
Но вместе с тобой мне ничего не страшно
Построим всё, но стен воздвигать не будем
Ссориться и заниматься любовью — ну что в этом плохого?

[Предприпев]
И заиграет музыка, и для тебя я буду петь
Величайший день тебе я подарю

[Припев]
Будем только ты и я
Связанные жизнью навсегда
Которая без тебя ничего не стоит
В которой нет смысла жить
С рукой на сердце
Я клянусь тебе пред Богом
Будем только ты и я
И с этого дня — навечно «да»

[Бридж]
Только «да»
Для этих дней и тысячи других
Простое «да»
Вечность заключена в одном слове

[Припев]
Будем только ты и я
Связанные жизнью навсегда
Которая без тебя ничего не стоит
В которой нет смысла жить
С рукой на сердце
Я клянусь тебе пред Богом
Будем только ты и я
И с этого дня — навечно «да»",,"Ballad, Disco funk","Диско-фанк, Баллада",,,https://www.youtube.com/watch?v=kA7pS6kaTpg,https://www.youtube.com/watch?v=V406FAGkhyQ,SF1_AUTO,7,,AUTO
LT,Sólo quiero más,,I just want more,Я просто хочу большего,"Lithuanian, English, Spanish","German, French, Italian","Литовский, Английский, испанский","Немецкий, Французский, Итальянский","[Verse 1]
Tai gąsdina, vaidenasi visur kur aš esu
Kas drįsta, tas klausia dėl ko aš gyvenu?
Tai nežeidžia manęs jau seniai
Tai nežeidžia manęs jau
Vis iš naujo sukuosi, rūke tiesios krantai
Sako į vidų žvelki ir rasi ko niekad neradai
Kai viskas griūna gyvenimą pamatau
Ir kuo toliau žiūriu
Aš tiesiog noriu daugiau

[Chorus]
Sólo quiero más
Even if we're living in a mad world
Even if there're no more gods to pray for
(Sólo quiero, sólo quiero más)
Sólo quiero más
Even if we're living in a mad world
Even if we're standing as the sky falls
Sólo quiero
Sólo quiero más
Sólo quiero más

[Bridge]
Dolor y alegría, así es la vida
Gal lengviau būtų su subtitrais?
Comme dans un vieux film la doulеur
Crée la musique qui unit sans mots

[Chorus]
Sólo quiero más
Evеn if we're living in a mad world
Even if there're no more gods to pray for
(Sólo quiero, sólo quiero más)
Sólo quiero más
Even if we're living in a mad world
Even if we're standing as the sky falls
(Sólo quiero)
(Sólo quiero más)
Sólo quiero más
(Even if we're living in a mad world)
Ich will einfach mehr
(Even if there're no more gods to pray for)
Je veux juste plus
(Even if we're living in a mad world)
Voglio solo di più
(Even if we're standing as the sky falls)
Aš tiesiog noriu daugiau","[Verse 1]
It scares me, it plays everywhere I go
Whoever dares asks what I live for?
It hasn't hurt me for a long time
It doesn't hurt me anymore
I keep turning around, the fog is straight shores
They say look inside and you'll find something you've never found
When everything falls apart I see life
And the further I look
I just want more

[Chorus]
I just want more
Even if we're living in a mad world
Even if there are no more gods to pray for
I just want more
I just want more
Even if we're living in a mad world
Even if we're standing as the sky falls
I just want
I just want more
I just want more

[Bridge]
Pain and joy, that's life
Maybe lengviau būtų in his subtitles?
Like in an old movie the pain
Create music that unites without words

[Chorus]
I just want more
Even if we're living in a mad world
Even if there're no more gods pray for
I just want I just want more
I just want more
Even if we're living in a mad world
Even if we're standing as the sky falls
I just want
I just want more
I just want more
(Even if we're living in a mad world)
I just want more
(Even if there're no more gods pray for)
I just want more
(Even if we're living in a mad world)
I just want more
(Even if we're standing as the sky falls)
I just want more","Это пугает, это преследует, где бы я ни был.
Кто посмеет спросить: ""Ради чего я живу?""
Это не причиняло мне боли долгое время.
Это больше не причиняет мне боли.
Я продолжаю кружиться снова и снова, в тумане — берега истины.
Говорят, загляни внутрь себя – и ты найдёшь то, что никогда не находил.
Когда всё рушится, я вижу жизнь.
И чем дальше я смотрю...
Я просто хочу большего.

Я просто хочу большего.
Даже если мы живём в безумном мире.
Даже если больше нет богов, которым можно молиться.
Я просто хочу, я просто хочу большего.
Я просто хочу большего.
Даже если мы живём в безумном мире.
Даже если мы стоим, когда небо падает.
Я просто хочу.
Я просто хочу большего.
Я просто хочу большего.

Боль и радость — это жизнь.
Может быть, было бы легче с субтитрами?
Как в старом кино, пусть боль
Создаёт музыку, которая объединяет без слов.

Я просто хочу большего.
Даже если мы живём в безумном мире.
Даже если больше нет богов, которым можно молиться.
Я просто хочу, я просто хочу большего.
Я просто хочу большего.
Даже если мы живём в безумном мире.
Даже если мы стоим, когда небо падает.
Я просто хочу.
Я просто хочу большего.
Я просто хочу большего.
(Даже если мы живём в безумном мире.)
Я просто хочу большего.
(Даже если больше нет богов, которым можно молиться.)
Я просто хочу большего.
(Даже если мы живём в безумном мире.)
Я просто хочу большего.
(Даже если мы стоим, когда небо падает.)
Я просто хочу большего.",,"Art pop, Classical Crossover","Арт-поп, Классический кроссовер",,,https://www.youtube.com/watch?v=nWwMMMVkwRU,https://www.youtube.com/watch?v=0H-PXnbhG7A,SF1,14,12,
