country_code,song_title,song_title_en,song_title_translation_en,song_title_translation_ru,langs_en,langs_en_minor,langs_ru,langs_ru_minor,lyrics_original,lyrics_en,lyrics_ru,lyrics_size_modifier,genre_en,genre_ru,facts_en,facts_ru,national_final_url,music_video_url,round_sf,order_sf,number_sf,qualified_to_final
AL,Nân,,Mother,Мама,Albanian,,Албанский,,"[Hyrja]
Ta dish se nana po ju pret
E nana ju po ju përcjell
Nana në prag aty ngel në derë
Dy javë, dy vjet, iku kjo verë

[Strofa 1]
Zemra po dhemb
E lotin mezi po e mban
Ju tash po ikni, do qani pak
Do harroheni, për jetë ma t'mirë, e di
E ne na duket shohim hijet
Në korridor ecin me vrap
Dëgjojmë zërat, hala n'oborr

[Pararefreni]
E qeshun me t'madhe
Hap dritaren e askush nuk asht aty
Marr t'shtroj për t'fjet n'divana e n'tokë
Baj za, askush s'përgjigjet

[Refreni]
Ta dish se nana po ju pret
E nana ju po ju përcjell
Nana në prag aty ngel në derë
Dy javë, dy vjet, iku kjo verë

[Strofa 2]
Rri e kujtoj
Kët' vend që dikur s'pat qetësi
Rrëmujë e ngrohtë
Gjithë librat n'tokë
Shpejt u ba ftohtë
Shkretinë e plotë

[Refreni]
Ta dish se nana po ju pret
E nana ju po ju përcjell
Nana në prag aty ngel në derë
Dy javë, dy vjet, iku kjo verë
Ta dish se nana po ju pret
E nana ju po ju përcjell
Nana në prag aty ngel në derë
Dy javë, dy vjet, iku kjo verë
Ta dish se nana po ju pret
E nana ju po ju përcjell
Nana në prag aty ngel në derë
Dy javë, dy vjet, iku kjo verë

[Mbyllja]
Kur po vjen, moj nan?
Se malli m'than
Po mos u mërzit
Nana ka me t'prit","[Intro]
Know that your mom is waiting for you
And your mom is showing you the way
Mom stays there, standing at the door
Two weeks, two years, this summer is gone

[Verse 1]
Your heart is aching
And you’re barely holding back the tears
You're leaving now, you'll cry a little
Then you'll move on, I know it's for a better life
And to us it feels like we still see the shadows
They're running through the hallway
We still hear their voices out in the yard

[Pre-Chorus]
I hear their loud laughters
I open the window, but no one is there anymore
I take out the blankеts to make your bed on the couch or on thе floor
I call out, but no one answers

[Chorus]
Know that your mom is waiting for you
And your mom is sending you off
Mom stands there at the doorway
Two weeks, two years, this summer is gone

[Verse 2]
I sit and remember
When this place was never quiet
A warming mess
All the books on the floor
It quickly turned cold
An empty wasteland

[Chorus]
Know that your mom is waiting for you
And your mom is sending you off
Mom stands there at the doorway
Two weeks, two years, this summer is gone
Know that your mom is waiting for you
And your mom is sending you off
Mom stands there at the doorway
Two weeks, two years, this summer is gone
Know that your mom is waiting for you
And your mom is sending you off
Mom stands there at the doorway
Two weeks, two years, this summer is gone

[Outro]
When are you coming, my child?
'Cause my longing is eating me
But don't be sad
Mom will be waiting for you","Знай, что мама ждёт тебя,
Она машет тебе вслед у дороги.
Всё ещё стоит у двери,
Пока две недели, два года, да и это лето тоже – прошло.

Моё сердце болит,
Я едва сдерживаю слёзы.
Теперь ты уходишь, ты поплачешь немного,
А потом забудешь ради лучшей жизни, я знаю.
Мы всё ещё видим ваши тени,
Что бегут по коридору,
И слышим ваши голоса, что тихим эхом отдаются во дворе.

Я слышу громкий смех,
Открываю окно, но там никого нет.
Я застилаю постели на диванах и на полу,
Зову вас по именам — никто не откликается.

Знай, что мама ждёт тебя,
Она машет тебе вслед у дороги.
Всё ещё стоит у двери,
Пока две недели, два года, да и это лето тоже – прошло.

Сижу и вспоминаю это место —
Когда-то оно не знало покоя даже ночью.
Тёплая, полная беспорядка жизнь,
Книги на полу.
Внезапно стало холодно,
Осталась лишь пустыня.

Знай, что мать ждёт тебя,
Она машет тебе вслед у дороги.
Всё ещё стоит у двери,
Пока две недели, два года, да и это лето тоже – прошло.
Знай, что мать ждёт тебя,
Она машет тебе вслед у дороги.
Всё ещё стоит у двери,
Пока две недели, два года, да и это лето тоже – прошло.
Знай, что мать ждёт тебя,
Она машет тебе вслед у дороги.
Всё ещё стоит у двери,
Пока две недели, два года, да и это лето тоже – прошло.

Когда ты вернёшься, дитя моё?
Эта тоска сжигает изнутри.
Но не беспокойся,
Мама будет ждать тебя.",1,"Pop, Ballad","Поп, Баллада",,,https://www.youtube.com/watch?v=-2cZ-Ba6ygg,https://www.youtube.com/watch?v=b9AdRrA554o,SF2,16,13,
AM,Paloma Rumba,,,Палома Румба,English,,Английский,,"[Intro]
Pa-la-la-la-la
La-la-la-la-la
Pa-la-la-la-la-la

[Verse 1]
Same old place, familiar faces
Copy paste my days
(Put on a smile and go on)
One last round of kissing the ground
And then I'll be gone for good

[Chorus]
Paloma Rumba, let's go
Delete my number burn the phone

[Verse 2]
Take my chance to finally dance
Away from all the anger
Too much sweat and tears and regrets
'Cause I don't wanna talk about numbers all day long

[Chorus]
Paloma Rumba, let's go
Rock this, rock this
Delete my number burn the phone
Rock this, rock this

[Verse 3]
I'm not a machine just stuck on a wage
In a rage, as a cage with a badge, oh no
Can't take no more, takе no more
I'm done for sure, yеah (Put on a smile and go on)
I'm not a robot just playing the part
And I'm losing my heart I'm falling apart
So watch me go steal the show
Like a pro, yeah

[Verse 4]
This meeting could have been an email
Free coffee won't keep me here man
Can't do this anymore
Already at the door

[Chorus]
Paloma Rumba, let's go
Rock this, rock this
Delete my number burn the phone
Rock this, rock thiѕ

[Bridge]
You ole-ole-ole-ole-fa, Paloma Rumba
You ole-ole-ole-ole-fa, Paloma Rumba
You ole-ole-ole-ole-fa, Paloma Rumba
You ole-ole-ole-ole-fa, Paloma Rumba
Are you ready?

[Outro]
Pa-la-la-la-la (Rock this)
La-la-la-la-la (Rock this)
Pa-la-la-la-la-la
Go, one more time",,"[Интро]
Па-ла-ла-ла-ла-ла
Ла-ла-ла-ла-ла-ла
Па-ла-ла-ла-ла-ла-ла

[Куплет 1]
То же старое место, знакомые лица
Скопируй и вставь мои дни
(Улыбнись и продолжай)
Последний раз поцелую землю
А потом уйду навсегда

[Припев]
Палома Румба, поехали
Сотри мой номер, сожги телефон

[Куплет 2]
Воспользуюсь шансом наконец-то потанцевать
Вдали от всего этого гнева
От пота, слёз и сожалений
Потому что я не хочу целыми днями говорить о цифрах

[Припев]
Палома Румба, поехали
Зажигай, зажигай
Сотри мой номер, сожги телефон
Зажигай, зажигай

[Куплет 3]
Я не машина, которая просто отрабатывает зарплату
В ярости, как клетка со значком, о нет
Я больше не могу, не могу больше
С меня хватит, да (улыбнись и продолжай)
Я не робот, который просто играет свою роль
Я теряю сердце, я разваливаюсь на части
Так что смотри, как я затмеваю всех
Как профи, да

[Куплет 4]
Эту встречу можно было заменить письмом
Бесплатный кофе меня здесь не удержит
Я больше не могу
Я уже у двери

[Припев]
Палома Румба, поехали
Зажигай, зажигай
Сотри мой номер, сожги телефон
Зажигай, зажигай

[Бридж]
Ты оле-оле-оле-оле-фа, Палома Румба
Ты оле-оле-оле-оле-фа, Палома Румба
Ты оле-оле-оле-оле-фа, Палома Румба
Ты оле-оле-оле-оле-фа, Палома Румба
Ты готова?

[Аутро]
Па-ла-ла-ла-ла (Зажигай)
Ла-ла-ла-ла-ла (Зажигай)
Па-ла-ла-ла-ла
Иди, ещё разок",,"Pop, Pop-rock","Поп, Поп-рок","The lyrics were written by Rosa Linn, the writer and performer of “Snap” (Armenia 2022).","Текст песни написала Роза Линн, авторка и исполнительница песни Snap (Армения-2022).",,https://www.youtube.com/watch?v=5EXoK-lgocw,SF2,7,6,
AT,Tanzschein,,Dance License,Танцевальная лицензия,German,,Немецкий,,"[Strophe 1]
Steh' vor dem Club (Ey), bin schon gespannt
Sag, hast du Lust auf einen Tanz?
Wir treten ein, mh, auf der Suche nach Ekstase
Doch hinterm Neonlichterschein liegt eine Tier-Oase
Und der Löwe versucht's bei einer Gazelle
Der Hunger macht ihn böse und er rückt ihr auf die Pelle
Im Gehege geht er durch wie einе Säge
Ist bekanntlich nicht romantisch, er stеht nicht aufs Gerede

[Pre-Refrain]
Ey, ey, das kann doch gar nicht wahr sein
Die machen sich zum Affen und Tänzer seh' ich gar kein'n
Ey, ey, ich hätt eine Idee, ein Konzept
Ja, das wär einfach perfekt

[Refrain]
Sie brauchen einen Tanzschein, da muss ich streng sein
Weil ohne Tanzschein, lass ich Sie nicht rein
Hab'n Sie einen Tanzschein? Das soll kein Witz sein
Weil ohne Tanzschein, da komm'n Sie nicht rein

[Strophe 2]
Ich schließ die Augen, dann bin ich Clubbesitzer
Und auf der schwarzen Liste steh'n die Steroidenspritzer
Und auch wenn sie nur bell'n und eigentlich gar nicht beißen
Das ist hier die Regel, Hunde müssen draußen bleiben

[Pre-Refrain]
Ey, ey, so kann es jeden Tag sein
Wir tanzen durch die Nacht und Löwen seh' ich gar kein'n
Ey, ey, draußen macht sich wer zum Affen
Doch der Türsteher sagt mit einem Lachen

[Refrain]
Sie brauchen einen Tanzschein, da muss ich streng sein
Weil ohne Tanzschein, lass ich Sie nicht rein
Hab'n Sie einen Tanzschein? Das soll kein Witz sein
Weil ohne Tanzschein, da komm'n Sie nicht rein

[Bridge]
Der Gorilla in der Ecke träumt von seiner Pirouette
Er scheut sich vor den Blicken, die die Artgenossen schicken
Ich nehm ihn an der Hand, ja, bildet einen Gang
Wir schau'n uns in die Augen und jetzt fang'n wir an

[Interlude]
Ey, ey, ey, ey, du kannst mir vertrau'n
Ey, ey, ey, ey, hier ist alles erlaubt
Oh, oh-oh, oh
Wir hab'n uns doch lang genug versteckt

[Refrain]
Und alle wollen einen Tanzschein, sie wollen wie wir sein
Doch ohne Tanzschein werden sie Tiere bleiben
Hab'n Sie einen Tanzschein? Das soll kein Witz sein
Weil ohne Tanzschein, da komm'n Sie nicht rein","[Verse 1]
I'm standing by the club (Ay), I'm already excited
Tell me, do you wanna dance?
We enter, mm, in search of ecstasy
But behind the neon lights there's an animal oasis
And the lion tries it on a gazelle
Hunger makes him angry, and he gets on her nerves
He cuts through the enclosure like a saw
He's known as non-romantic, and he also doesn't like the talk

[Pre-Chorus]
Ay, ay, that can't be true
They act like monkeys, and I don't see any dancers
Ay, ay, I have an idea, a concept
Yeah, that'd be just perfect

[Chorus]
You need a dance license, I have to be strict about that
'Cause without a dance license, I won't let you in
Do you have a dance license? This isn't a joke
'Cause without a dance license, you can't come in

[Verse 2]
I close my eyes, then I'm a club owner
And the steroid injectiors are blacklisted
And even if they just bark and don't actually bite
There's a rule that says that dogs must stay outside

[Pre-Chorus]
Ay, ay, this can be like that every day
We're dancing through the night and I don't see any lions
Ay, ay, someone's acting like a monkey
But the bouncer says with a laugh

[Chorus]
You need a dance license, I have to be strict about that
'Cause without a dance license, I won't let you in
Do you have a dance license? This isn't a joke
'Cause without a dance license, you can't come in

[Bridge]
The gorilla in the corner is dreaming of his pirouette
He shies away from the looks that his kinsmen send
I'll take him by the hand, yes, let's have a walk
We'll look into each other's eyes and now let's get it started

[Interlude]
Ay, ay, ay, ay, you can trust me
Ay, ay, ay, ay, everything's allowed here
Oh, oh-oh, oh
We've been hiding long enough

[Chorus]
And everyone wants a dance license, they want to be like us
But without a dance license, they'll remain animals
Do you have a dance license? This isn't a joke
'Cause without a dance license, you can't come in","[Куплет 1]
Стоя перед клубом (Эй), я уже в восторге
Скажи, не хочешь потанцевать?
Мы входим, м-м, в поисках экстаза
Но за неоновым светом скрывается животный оазис
Где лев искушает газель
Голод делает его злым, он действует ей на нервы
Он прорезает свою клетку, словно пила
Известно, что он не романтичен и не любит разговоров

[Предприпев]
Эй, эй, это не может быть правдой
Они ведут себя как обезьяны, а я не вижу танцоров
Эй, эй, у меня возникла одна идея, некая концепция
Да, это было бы просто идеально

[Припев]
Вам нужна танцевальная лицензия, я должен быть строг с этим
Потому что без танцевальной лицензии я вас не впущу
У вас есть танцевальная лицензия? Я не шучу
Потому что без танцевальной лицензии вы сюда не попадёте

[Куплет 2]
Я закрываю глаза, представляю себя владельцем клуба
Где шприцы со стероидами в чёрном списке
И даже если они просто лают, но не кусают
Такие у нас тут правила, собаки должны оставаться на улице

[Предприпев]
Эй, эй, так могло бы быть каждый день
Мы танцуем всю ночь напролёт, и я не вижу львов
Эй, эй, кто-то снаружи ведёт себя как обезьяна
Но вышибала говорит со смехом

[Припев]
Вам нужна танцевальная лицензия, я должен быть строг с этим
Потому что без танцевальной лицензии я вас не впущу
У вас есть танцевальная лицензия? Я не шучу
Потому что без танцевальной лицензии вы сюда не попадёте

[Бридж]
Горилла в углу мечтает о пируэте
Он сторонится взглядов, которые кидают его сородичи
Я беру его за руку, да, давай прогуляемся
Мы смотрим друг другу в глаза, и теперь начинаем

[Интерлюдия]
Эй, эй, эй, эй, ты можешь мне доверять
Эй, эй, эй, эй, эй, здесь разрешено всё
О-о-о-о-о
Мы достаточно долго скрывались

[Припев]
И все хотят получить танцевальную лицензию, хотят быть как мы
Но без танцевальной лицензии они останутся животными
У вас есть танцевальная лицензия? Я не шучу
Потому что без танцевальной лицензии вы сюда не попадёте",,Dance-Pop,Дэнс-поп,The idea for the song came when Cosmó went to a club and saw that nobody was dancing.,"Идея песни появилась, когда Космо пришёл в клуб и увидел, что никто не танцует.",https://www.youtube.com/watch?v=SPpL_ZuRTZY,https://www.youtube.com/watch?v=zPGP9ZphxiY,SF2_AUTO,10,,AUTO
AU,Eclipse,,,Затмение,English,,Английский,,"[Verse 1]
Shadows in the moonlight
Dancing with the sun
Planets are aligning
To love as one
And it won't be long
Till the morning comes
In a sky full of stars
Though our lives were apart
We've only just begun

[Chorus]
One touch, one kiss
All my life for a night like this
The world stops for us
Only love exists

[Post-Chorus]
When we eclipse
When we eclipse
When we eclipse (Oh-oh-oh-oh)
When we eclipse (Oh-oh, oh-oh)

[Verse 2]
Call it perfect timing
I call it divine
Gravity is pulling
Your heart to mine
And it won't be long
Till the morning comes
In a sky full of stars,
I am right where you are
Forever’s just begun

[Chorus]
One touch, one kiss
All my life for a night like this
The world stops for us
Only love exists

[Post-Chorus]
When we eclipse (Oh)
When we eclipse
When we eclipse (Oh-oh-oh-oh)
When we eclipse (Oh-oh, oh-oh)

[Bridge]
Hey! (Oh, oh)
When we eclipse (Oh)
We are one love

[Chorus]
One touch, one kiss
All my life for a night like this
The world stops for us
Only love exists

[Post-Chorus]
When we eclipse (Oh-oh-oh-oh)
When we eclipse (Oh-oh-oh-oh)
When we eclipse (Oh-oh-oh-oh)
When we eclipse (Oh-oh-oh-oh)",,"Тени от лунного света
Танцуют с солнцем,
Планеты выстраиваются в линию
В знак любви,
Но пройдёт немного времени,
И наступит утро,
В небе, усыпанном звёздами,
Наши судьбы разминутся,
Но для нас это только начало.

Одно прикосновение, один поцелуй,
Всю свою жизнь я ждала эту ночь,
Мир останавливается ради нас,
И есть лишь любовь,

Когда случается наше затмение,
Когда случается наше затмение,
Когда случается наше затмение (о-о-о-о),
Когда случается наше затмение (о-о-о-о).

Считай это совпадением,
Но для меня это божий замысел,
Гравитация тянет
Твоё сердце к моему,
Но пройдёт немного времени,
И наступит утро,
В небе, усыпанном звёздами,
Я буду рядом с тобой,
Вечность начинается прямо сейчас.

Одно прикосновение, один поцелуй,
Всю свою жизнь я ждала эту ночь,
Мир останавливается ради нас,
И есть лишь любовь,

Когда случается наше затмение (о),
Когда случается наше затмение,
Когда случается наше затмение (о-о-о-о),
Когда случается наше затмение (о-о-о-о).

Эй! (О-о)
В миг нашего затмения (о)
Мы объединены любовью.

Одно прикосновение, один поцелуй,
Всю свою жизнь я ждала эту ночь,
Мир останавливается ради нас,
И есть лишь любовь,

Когда случается наше затмение (о-о-о-о),
Когда случается наше затмение (о-о-о-о),
Когда случается наше затмение (о-о-о-о),
Когда случается наше затмение (о-о-о-о).",,"Pop, Power pop","Поп, Пауэр-поп",The song was released during an eclipse.,Песню выпустили во время затмения.,,https://www.youtube.com/watch?v=EUMCr1pnaMY,SF2,13,11,
AZ,Just Go,,,Просто уходи,"English, Azerbaijani",,"Английский, Азербайджанский",,"[Verse 1]
I carried your love
Inside my heart each day
You said our fire
Would never fade away
Your name was my dream at night
Your name when I saw the light
Oh, I was yours all the way

[Pre-Chorus]
But now I see through your disguise
The truth is burning in my eyes

[Chorus]
Go, I don't love you anymore
Go, without you I'll shine
You know, I'll erase you from my soul
Go, I don't want to see your face
Go, no more tears will ever flow
I'm begging you, just go

[Verse 2]
You said we'd be forever side by side
You said our love would never die
But you fooled me once again
You played your little game
You burned the faith I had inside

[Pre-Chorus]
Now every word feels like a lie
I'm done, I'm saying goodbye

[Chorus]
Go, I don't love you anymore
Go, without you I'll shine
You know, I'll erase you from my soul
Go, I don't want to see your face
Go, no more tears will ever flow
I'm begging you, just go

[Bridge]
Məni tərk et yoruldum yalanından
Məni tərk et bezmişəm bu oyundan
Məni tərk et qurtulum bu alovdan
Məni tərk et çıx mənim dünyamdan

[Outro]
Go
Go","[Verse 1]
I carried your love
Inside my heart each day
You said our fire
Would never fade away
Your name was my dream at night
Your name when I saw the light
Oh, I was yours all the way

[Pre-Chorus]
But now I see through your disguise
The truth is burning in my eyes

[Chorus]
Go, I don't love you anymore
Go, without you I'll shine
You know, I'll erase you from my soul
Go, I don't want to see your face
Go, no more tears will ever flow
I'm begging you, just go

[Verse 2]
You said we'd be forever side by side
You said our love would never die
But you fooled me once again
You played your little game
You burned the faith I had inside

[Pre-Chorus]
Now every word feels like a lie
I'm done, I'm saying goodbye

[Chorus]
Go, I don't love you anymore
Go, without you I'll shine
You know, I'll erase you from my soul
Go, I don't want to see your face
Go, no more tears will ever flow
I'm begging you, just go

[Bridge]
Go, I've had enough of your lies
Go, I'm sick of this game
Go, free me from this flame
Go, get out of my world

[Outro]
Go
Go","Я берегла твою любовь
В своём сердце день ото дня,
Ты сказал, что нашей страсти
Никогда не угаснуть,
Твой имя снилось мне по ночам
И было светом для меня,
Я всецело была твоей.

Но теперь я вижу твою маску,
Правда прожигает мне глаза.

Уходи, я больше тебя не люблю,
Уходи, без тебя я буду сиять,
Ты знаешь, я сотру тебя из своей души,
Уходи, я не хочу видеть твоего лица,
Уходи, больше не будет слёз рекой,
Я молю тебя, просто уходи.

Ты сказал, что мы всегда будем рядом,
Ты сказал, что наша любовь никогда не умрёт,
Но ты опять меня обманул,
Играя в свою хитрую игру,
Ты сжёг веру, которая была внутри.

Теперь все слова звучат, как ложь,
Хватит с меня, я говорю ""прощай"".

Уходи, я больше тебя не люблю,
Уходи, без тебя я буду сиять,
Ты знаешь, я сотру тебя из своей души,
Уходи, я не хочу видеть твоего лица,
Уходи, больше не будет слёз рекой,
Я молю тебя, просто уходи.

Оставь меня, я устала от твоей лжи,
Оставь меня, мне надоели твои игры,
Оставь меня, я освободилась от этого огня,
Оставь меня, уходи из моего мира.

Уходи,
Уходи.
",,"Pop, Ballad","Поп, Баллада",,,,https://www.youtube.com/watch?v=iMDBPe25JhM,SF2,2,2,
