country_code,song_title,song_title_en,song_title_translation_en,song_title_translation_ru,langs_en,langs_en_minor,langs_ru,langs_ru_minor,lyrics_original,lyrics_en,lyrics_ru,lyrics_size_modifier,genre_en,genre_ru,facts_en,facts_ru,national_final_url,music_video_url,round_sf,order_sf,number_sf,qualified_to_final
LU,Mother Nature,,,Мать-природа,English,,Английский,,"[Verse 1]
From the start
When all was fun and games
Wasn't hard
But all good things can end
Back when I was younger
I planted a seed under the moonlight
And even when there's thunder
I go back when I wonder, ""Who am I?""

[Chorus]
From the ground to my skin
As I'm howling at the wind
Dig my roots in the mud
And I lean my head back
Let it out, let it in
Letting go of all my sins
Dig my roots in the mud
And I lean my head back

[Post-Chorus]
Mother Nature, she knows
Mother Nature, she knows
I know that
Mother Nature, she knows
Mother Nature, she knows
Mother Nature, shе knows

[Verse 2]
See the leaves
How thеy grow back again
And I heal
Then learn to love myself again
Even when there's thunder
Oh, I don't have to wonder, ""Who am I?""

[Chorus]
From the ground to my skin
As I'm howling at the wind
Dig my roots, in the mud
And I lean my head back
Let it out, let it in
Letting go off all my sins
Dig my roots in the mud
And I lean my head back

[Post-Chorus]
Mother Nature, she knows
Mother Nature, she knows
I know that
Mother Nature, she knows
Mother Nature, she knows

[Outro]
Oh, oh, oh…
(Mother Nature, she knows)
Mhm, Mother Nature, she knows",,"[Куплет 1]
Поначалу
Когда всё было просто игрой
Жилось легко
Но всё хорошее когда-нибудь заканчивается
Однажды, когда я была моложе
Я посадила семечко при лунном свете
И даже в непогоду
Я прихожу к нему, когда терзаюсь вопросом: «А кто я?»

[Припев]
От земли к моей коже
Когда я вою на ветру
Зарываюсь корнями в грязь
И откидываю голову назад
Я принимаю, я отпускаю
Отпускаю все свои грехи
Зарываюсь корнями в грязь
И откидываю голову назад

[Постприпев]
Мать-природа знает
Мать-природа знает
Я знаю, что
Мать-природа знает
Мать-природа знает
Мать-природа знает

[Куплет 2]
Вижу листья
И как они отрастают
Тогда я исцеляюсь
И учусь снова любить себя
Даже в непогоду
О, мне не приходится задаваться вопросом: «А кто я?»

[Припев]
От земли к моей коже
Когда я вою на ветру
Зарываюсь корнями в грязь
И откидываю голову назад
Я принимаю, я отпускаю
Отпускаю все свои грехи
Зарываюсь корнями в грязь
И откидываю голову назад

[Постприпев]
Мать-природа знает
Мать-природа знает
Я знаю, что
Мать-природа знает
Мать-природа знает

[Аутро]
Оу-оу-оу…
(Мать-природа знает)
Ммм, Мать-природа знает",,Pop-folk,Поп-фолк,,,https://www.youtube.com/watch?v=DmVfJSRqgnI,,SF2,4,4,
LV,Ēnā,,In the shade,В тени,Latvian,,Латвийский,,"[1. Pants]
Tik daudz silta aukstiem ļaudīm dots
Bet pie tuviem atnāc iztukšots
Citu acīm skaisti izgleznots
Bet viens piliens pārvērš Tevi toņos melnbaltos

[Piedziedājums]
Un tā lēnām, lēnām kļūsti mēmāks
Lēni lēnām, lēnām paliec ēnā
Tu domā vēlāk, vēlāk nedaudz vēlāk
Un tā lēnām, lēnām paliec ēnā

[2. Pants]
Meitiņ klusē, veļu necilā
Šonakt tētis mājās nepārnāks
Rīt ar smaidu glāzi skandinās
Slīksim kopā šaubu atvarā

[Piedziedājums]
Un tā lēnām, lēnām kļūsti mēmāks
Lēni lēnām, lēnām paliec ēnā
Tu domā vēlāk, vēlāk nedaudz vēlāk
Un tā lēnām, lēnām paliec ēnā

[Tilts]
(Lēnām, lēnām)
(Lēnām, lēnām)

[Nobeigums]
Lēnām, lēnām paliec ēnā","[Verse 1]
So much warmth is given to cold ones
Yet when you reach the close ones, you arrive emptied
In others' eyes you're painted beautifully
But a single water drop can turn you black and white

[Chorus]
And so slowly, slowly you grow more silent
Slowly, slowly, slowly you fade into the shadows
You think ""Later, later, a little later""
And so slowly, slowly you fade into the shadows

[Verse 2]
Daughter, keep quiet, don't stir the veils
Today father will not come home
Tomorrow with a smile the glasses will be raised
Together we'll drown in the whirlpool of doubt

[Chorus]
And so slowly, slowly you grow more silent
Slowly, slowly, slowly you fade into shadow
You think ""Later, later, a little later""
And so slowly, slowly you fade into shadow

[Bridge]
(Slowly, slowly)
(Slowly, slowly)

[Outro]
Slowly, slowly you fade into shadow","[Куплет 1]
Столько тепла отдаётся холодным рукам
А как встретишь близких, остаётся лишь пустота
Чужие глаза могут увидеть в тебе столько красоты
Но одной капли хватит, чтобы отобрать все цвета

[Припев]
И медленно, медленно ты затихаешь
Медленно, медленно в тени угасаешь
Думаешь: «Позже, позже, немного позже»
И так медленно, медленно в тени угасаешь

[Куплет 2]
Тише, дочь, не поднимай шуму
Сегодня папа не вернётся домой
Завтра с улыбками бокалы будут подняты
Мы вместе утонем в водовороте сомнений

[Припев]
И медленно, медленно ты затихаешь
Медленно, медленно в тени угасаешь
Думаешь: «Позже, позже, немного позже»
И так медленно, медленно в тени угасаешь

[Бридж]
(Медленно, медленно)
(Медленно, медленно)

[Аутро]
Медленно, медленно в тени угасаешь",,"Indie pop, Ballad","Инди-поп, Баллада",,,https://www.youtube.com/watch?v=6C2ivaB5D00,,SF2,11,9,
MD,"Viva, Moldova!",,Long live Moldova!,Да здравствует Молдова!,Romanian,"Spanish, English, French, Italian, Hawaiian and Latin",Румынский,"Испанский, Английский, Французский, Итальянский, Гавайский, Латынь","[Refren: Satoshi]
Viva Moldova, aloha, adio, vida loca
Soroca, Europa, Palma de Mallorca
Salute a tutti, Moldova is on duty
E una e nova, welcome to Moldova
Moldova, aloha, adio, vida loca
Soroca, Europa, Palma de Mallorca
Salute a tutti, Moldova is on duty
E una e nova, Republica Moldova

[Strofa 1: Satoshi]
Patria-mamă, te amo, forever ne cheamă
La lucru, la zeamă, noi trecem vamă
Familia e baza, mi casa es su casa
Asseyez-vous la masă, şi spune-ne qué pasa

[Pre-refren: Satoshi]
Undeva, undeva, între praf și stele
Suntem noi, rătăcit stringând spre ele

[Refren: Satoshi]
Viva Moldova, aloha, adio, vida loca
Soroca, Europa, Palma de Mallorca
Salute a tutti, Moldova is on duty
E una e nova, Republica Moldova

[Post-refren: Satoshi]
Welcome to Moldova
Republica Moldova

[Strofa 2: Satoshi]
Doina, te quiero
Hora, te quiero
Limba română, moldovano vero
Vibe-ul mereu Maria Mirabela
Focul din vatră
Doga, Vieru
Peace, Europa
Hasta la vista
Asta e viața, nu mai fi tristă
In vino veritas — vine Moldova
Noroc, Cin-cin, Terra Nova

[Punte: Aliona Moon]
Dorule, dorule, du-mă, dorule
Dorule, dorule, du-mă, dorule
Dorule, dorule, du-mă, dorule
Dorule, dorule, dor-

[Refren: Satoshi]
Viva Moldova, aloha, adio, vida loca
Soroca, Europa, Palma de Mallorca
Salute a tutti, Moldova is on duty
E una e nova, welcome to Moldova
Moldova, aloha, adio, vida loca
Soroca, Europa, Palma de Mallorca
Salute a tutti, Moldova is on duty
E una e nova, Republica Moldova

[Outro: Satoshi]
Welcome to Moldova
Welcome to Moldova","[Chorus]
Long live Moldova, hello, goodbye, crazy life
Soroca, Europe, Palma de Mallorca
Greetings to everyone, Moldova is on duty
It is one and it is new, welcome to Moldova
Moldova, hello, goodbye, crazy life
Soroca, Europe, Palma de Mallorca
Greetings to everyone, Moldova is on duty
It is one and it is new, the Republic of Moldova

[Verse 1]
Mother homeland, I love you, forever it calls us
To work, to the soup from longing for mother
Family is the foundation, my home is your home
Sit down at the table and tell us what's going on

Somewhere, somewhere between dust and stars
There are us, lost, crying out to them

[Chorus]
Long live Moldova, hello, goodbye, crazy life
Soroca, Europе, Palma de Mallorca
Greetings to everyonе, Moldova is on duty
It is one and it is new, the Republic of Moldova

[Post-Chorus]
Welcome to Moldova
The Republic of Moldova

[Verse 2]
Doina, I love you
Hora, I love you
The Romanian language, truly Moldovan
The vibe is always Maria Mirabela
The fire in the hearth
Doga, Vieru
Peace, Europe
See you later
That's life, don't be sad anymore
In wine there is truth — Moldova is coming
Bottoms up, cheers, New Land

Longing, longing, take me away, longing
Longing, longing, take me away, longing
Longing, longing, take me away, longing
Longing, longing, lon-

[Chorus]
Long live Moldova, hello, goodbye, crazy life
Soroca, Europe, Palma de Mallorca
Greetings to everyone, Moldova is on duty
It is one and it is new, welcome to Moldova
Moldova, hello, goodbye, crazy life
Soroca, Europe, Palma de Mallorca
Greetings to everyone, Moldova is on duty
It is one and it is new, the Republic of Moldova

[Post-Chorus]
Welcome to Moldova
Welcome to Moldova","[Припев]
Да здравствует Молдова, привет, прощай, безумная жизнь
Сороки, Европа, Пальма-де-Майорка
Привет всем, Молдова на дежурстве
Она единственная, она новая, добро пожаловать в Молдову
Молдова, привет, прощай, безумная жизнь
Сороки, Европа, Пальма-де-Майорка
Привет всем, Молдова на дежурстве
Она единственная, она новая — Республика Молдова

[Куплет 1]
Родина-мать, я люблю тебя, она всегда зовёт нас
На работу, на похлёбку, с тоской по матери
Семья — это база, мой дом — твой дом
Присаживайся за стол и расскажи, что как там?

Где-то, где-то между пылью и звёздами
Это мы — потерянные, кричим к ним

[Припев]
Да здравствует Молдова, привет, прощай, безумная жизнь
Сороки, Европа, Пальма-де-Майорка
Привет всем, Молдова на дежурстве
Она единственная, она новая — Республика Молдова

[Постприпев]
Добро пожаловать в Молдову
Республика Молдова

[Куплет 2]
Дойна, люблю тебя
Хора, люблю тебя
Румынский язык, воистину — молдавский
Наш вайб всегда как у Марии Мирабелы
Огонь в очаге
Дога, Виеру
Мир, Европа
До встречи
Такова жизнь, не печалься
Истина в вине — надвигается Молдова
Выпьем, ваше здоровье, Новая Земля

[Предприпев]
Тоска, тоска, унеси меня, тоска
Тоска, тоска, унеси меня, тоска
Тоска, тоска, унеси меня, тоска
Тоска, тоска, тос-

[Припев]
Да здравствует Молдова, привет, прощай, безумная жизнь
Сороки, Европа, Пальма-де-Майорка
Привет всем, Молдова на дежурстве
Она единственная, она новая — Республика Молдова,
Молдова, привет, прощай, безумная жизнь
Сороки, Европа, Пальма-де-Майорка
Привет всем, Молдова на дежурстве
Она единственная, она новая — Республика Молдова

[Постприпев]
Добро пожаловать в Молдову
Добро пожаловать в Молдову",,Pop rap,Поп-рэп,,,https://www.youtube.com/watch?v=1JEmuzqob8c,https://www.youtube.com/watch?v=SViojHjNSzc,SF1,1,1,
ME,Нова зора,Nova zora,New dawn,Новая заря,Montenegrin,English,Черногорский,Английский,"[Strofa 1]
Ko je ovdje ko? Ma kraj je
Moj je jači hod (Jači hod), za dalje
Iz srca sad vadim olovo
Sve je gotovo, sve je gotovo

[Predrefren]
(Lijepe žene, jake kao stijene, žene)
(Lijepe žene, lijepe su zbog sebe)
Finally breathing and finding love inside

[Refren]
Kiša traje, kiša traje, nebo znak mi daje
Grmi sijeva, grmi sijeva, sudbina se mijenja
O-ou, o-o-ou, o-ou, o-ou
Iza gora, iza mora, rodila se nova zora

[Drop]
(Nova zora)

[Strofa 2]
Ko si ti da mi pričaš, ko sam ja?
Da l’ ću doć' ili poć'? Ja sam otišla
Sve što vodi do tebe, sam srušila
Iz tvojih otrova, se Sunce probija
I nova zora zasija

[Predrefren]
(Lijepe žene, jake kao stijene, žene)
(Lijepe žene, lijepe su zbog sebe)
Finally breathing and finding love inside

[Refren]
Kiša traje, kiša traje, nebo znak mi daje
Grmi sijeva, grmi sijeva, sudbina se mijenja
O-ou, o-o-ou, o-ou, o-ou
Iza gora, iza mora, rodila se nova zora

[Most]
Nema okova, nema okova, nema
Kô od gromova rođena žena
Nema okova, nema okova, nema
Kô od gromova rođena žena

[Refren]
Kiša traje, kiša traje, nebo znak mi daje
Grmi sijeva, grmi sijeva, sudbina se mijenja
O-ou, o-o-ou, o-ou, o-ou
Iza gora, iza mora, rodila se nova zora

[Završetak]
(Nova zora)","[Verse 1]
Who is who here? Well, it's the end
My gait is stronger now (Stronger now), for I go further
Now I'm pulling out lead from my heart
It's over now, it's over now

[Pre-Chorus]
(Beautiful women, strong as boulders, women)
(Beautiful women, beautiful for themselves)
Finally breathing and finding love inside

[Chorus]
The rain goes on, the rain goes on, the sky is giving me a sign
It thunders and flashes, it thunders and flashes, destiny is changing
O-oh, o-o-oh, o-o-oh
Behind the mountains, behind the seas, a new dawn is born

[Drop]
(A new dawn)

[Verse 2]
Who do you think you are to tell me who I am?
Will I come or go? I have already left
Everything that leads to you, I have demolished
Despite your poisons, the Sun breaks through
And a new dawn shines

[Pre-Chorus]
(Beautiful women, strong as boulders, women)
(Beautiful women, beautiful for themselves)
Finally breathing and finding love inside

[Chorus]
The rain goes on, the rain goes on, the sky is giving me a sign
It thunders and flashes, it thunders and flashes, destiny is changing
O-oh, o-o-oh, o-o-oh
Behind the mountains, behind the seas, a new dawn is born

[Bridge]
No more shackles, no more shackles, no
As if she was born from the thunders, a woman
No more shackles, no more shackles, no
As if she was born from the thunders, a woman

[Chorus]
The rain goes on, the rain goes on, the sky is giving me a sign
It thunders and flashes, it thunders and flashes, destiny is changing
O-oh, o-o-oh, o-o-oh
Behind the mountains, behind the seas, a new dawn is born

[Outro]
(A new dawn)","[Куплет 1]
Кто есть кто? Что же, конец настал
Мой шаг окреп (Шаг окреп), я двигаюсь дальше
Я вынимаю свинец из своего сердца
Всё кончено, всё кончено

[Предприпев]
(Прекрасные женщины, сильные как скалы, женщины)
(Прекрасные женщины, прекрасные сами по себе)
Наконец я дышу и нахожу любовь внутри

[Припев]
Дождь идёт, дождь идёт, небо знак мне даёт
Гремит и сверкает, гремит и сверкает, судьба меняется
О-у, о-о-у, о-у, о-у
За горами, за морями, родилась новая заря

[Дроп]
(Новая заря)

[Куплет 2]
Кем ты себя возомнил, чтобы рассказывать мне о том, кто я?
Приду ли я или пойду? Я уже ушла
Всё, что ведёт к тебе, я разрушила
Даже сквозь твой яд пробивается солнце
И новая заря засияет

[Предприпев]
(Прекрасные женщины, сильные как скалы, женщины)
(Прекрасные женщины, прекрасные сами по себе)
Наконец я дышу и нахожу любовь внутри

[Припев]
Дождь идёт, дождь идёт, небо знак мне даёт
Гремит и сверкает, гремит и сверкает, судьба меняется
О-у, о-о-у, о-у, о-у
За горами, за морями, родилась новая заря

[Бридж]
Нет оков, нет оков, нет
Женщина, рождённая из грома
Нет оков, нет оков, нет
Женщина, рождённая из грома

[Припев]
Дождь идёт, дождь идёт, небо знак мне даёт
Гремит и сверкает, гремит и сверкает, судьба меняется
О-у, о-о-у, о-у, о-у
За горами, за морями, родилась новая заря

[Аутро]
(Новая заря)",,"Electropop, Dance-Pop","Электропоп, Дэнс-поп",,,https://www.youtube.com/watch?v=59hsYOMCQGY,https://www.youtube.com/watch?v=nuvy2d60HbI,SF1,9,8,
MT,Bella,,Beautiful,Красавица,"English, Maltese",,"Английский, Мальтийский",,"[Verse]
Hello, my friend, is it the end?
I don't recall the time you said goodbye
Hello, my friend, I'm feeling blue
I gave it all, you took me by surprise

[Pre-Chorus]
What if our worlds align again?
Right by the summer sky, my friend
I hope you know it's fun to love again
And if you're feeling cold tonight
I'll meet you here now, don't be shy

[Chorus]
Che bella, jien hawn għadni nistenna
I'll keep holding onto you
After all of this time it's you, and only you
Bella, forsi taħseb ftit fija
All the nights that you danced with me
By the sea, they're calling me
Che bella

[Bridge]
Bella, bella, bella, bella
Bella, bella, bella
Bella, bella
After all this time it is you
Ma che bella, bella, bella
Bella, bella, bella, ah

[Pre-Chorus]
What if our worlds align again?
Right by the summer sky, my friend
I hope you know it's fun to love again
And if you're feeling cold tonight
I'll meet you here now, don't be shy

[Chorus]
Che bella, jien hawn għadni nistenna
I'll keep holding onto you
After all of this time it's you, and only you
Miskin min hu bħali, miskin min hu hekk
Irbaħtli l-battalja, int Jean la Valette
U tliftli kull sens, qed inħoss id-dinja ddur bija
Che bella, u ħallejtni nistenna
I'll keep holding onto you
After all of this time it's you, and only…
Che bella","[Verse]
Hello, my friend, is it the end?
I don't recall the time you said goodbye
Hello, my friend, I'm feeling blue
I gave it all, you took me by surprise

[Pre-Chorus]
What if our worlds align again?
Right by the summer sky, my friend
I hope you know it's fun to love again
And if you're feeling cold tonight
I'll meet you here now, don't be shy

[Chorus]
What a beauty, I’m still here waiting
I'll keep holding onto you
After all of this time it's you, and only you
Beauty, maybe you think of me a little
All the nights that you danced with me
By the sea, they're calling me
What a beauty

[Bridge]
Beauty, beauty, beauty, beauty
Beauty, beauty, beauty
Beauty, beauty
After all this time it is you
Oh, what a beauty, beauty, beauty
Beauty, beauty, beauty, ah

[Pre-Chorus]
What if our worlds align again?
Right by the summer sky, my friend
I hope you know it's fun to love again
And if you're feeling cold tonight
I'll meet you here now, don't be shy

[Chorus]
What a beauty, I’m still here waiting
I'll keep holding onto you
After all of this time it's you, and only you
Pity the one who is like me, pity the one who is like this
You won the battle against me, you are Jean la Valette
And I’ve lost all sense, I feel the world spinning around me
What a beauty, and you left me waiting
I'll keep holding onto you
After all of this time it's you, and only…
What a beauty","[Куплет]
Приветствую, подруга, неужели это конец?
Я не могу вспомнить, как ты попрощалась со мной
Приветствую, подруга, я окутан печалью
Я отдал тебе всё, а ты меня обманула

[Предприпев]
Но что, если наши миры столкнутся ещё раз?
Прямо под этим летним небом, подруга
Надеюсь, ты знаешь, что полюбить снова было бы приятно
И если вдруг тебе сегодня станет холодно одной
Я готов встретиться здесь и сейчас, ты только скажи

[Припев]
Какая красавица, я всё ещё жду тебя
Я не перестану цепляться за тебя
В конце концов, всё это оказалось лишь о тебе одной
Красавица, возможно, ты тоже обо мне вспоминаешь
И все те ночи, когда мы танцевали вместе
Около моря, я слышу его зов
Какая красавица

[Бридж]
Красавица, красавица, красавица, красавица
Красавица, красавица, красавица
Красавица, красавица
В конце концов, это всё о тебе
Красавица, красавица, красавица
Красавица, красавица, красавица, ах…

[Предприпев]
Но что, если наши миры столкнутся ещё раз?
Прямо под этим летним небом, подруга
Надеюсь, ты знаешь, что полюбить снова было бы приятно
И если вдруг тебе сегодня станет холодно одной
Я готов встретиться здесь и сейчас, ты только скажи

[Припев]
Какая красавица, я всё ещё жду тебя
Я не перестану цепляться за тебя
В конце концов, всё это оказалось лишь о тебе одной
Горе любому мужчине, такому как я, поступающему как я
Ты одержала победу, ты Жан ла Валетт
Я окончательно запутался, мир вокруг меня идёт кругами
Красавица, ты заставила меня ждать
Я не перестану цепляться за тебя
В конце концов, всё это оказалось лишь…
Какая красавица",,"Pop, Ballad","Поп, Баллада",,,https://www.youtube.com/watch?v=zpnUWz6NKMw,https://www.youtube.com/watch?v=CW6mQLBh6Js,SF2,17,14,
